{
    "$schema": "http://json-schema.org/draft-07/schema#",
    "title": "Indoor Map Schema",
    "description": "Schema for D&D indoor map data",
    "type": "object",
    "required": [
        "name",
        "gridSize",
        "walls",
        "placedItems",
        "players",
        "zoom",
        "panX",
        "panY",
        "fog"
    ],
    "properties": {
        "name": {
            "type": "string",
            "description": "The map name"
        },
        "description": {
            "type": "string",
            "description": "Markdown description of the map"
        },
        "gridSize": {
            "type": "integer",
            "minimum": 5,
            "maximum": 100,
            "description": "Grid dimension in cells"
        },
        "walls": {
            "type": "array",
            "items": {
                "type": "string",
                "pattern": "^\\d+,\\d+$"
            },
            "description": "Array of 'x,y' coordinate strings for wall cells"
        },
        "placedItems": {
            "type": "array",
            "items": {
                "type": "object",
                "required": [
                    "id",
                    "gridX",
                    "gridY",
                    "type",
                    "visible"
                ],
                "properties": {
                    "id": {
                        "type": "string",
                        "description": "Unique identifier for the placed item"
                    },
                    "gridX": {
                        "type": "integer",
                        "description": "Grid column position"
                    },
                    "gridY": {
                        "type": "integer",
                        "description": "Grid row position"
                    },
                    "type": {
                        "type": "string",
                        "enum": [
                            "altar",
                            "arrowSlitWall",
                            "bed",
                            "bookshelf",
                            "chair",
                            "chest",
                            "crate",
                            "door",
                            "firepit",
                            "fountain",
                            "npc",
                            "pillar",
                            "secretDoor",
                            "stairs",
                            "statue",
                            "table",
                            "torch",
                            "trap",
                            "web",
                            "tree",
                            "boulder",
                            "bush"
                        ],
                        "description": "The type of placed item.  Note: npc represents a monster of other non-player character type and should have name property set to exactly match the name in the Monster Manual for proper image lookup"
                    },
                    "visible": {
                        "type": "boolean",
                        "description": "Whether the item is visible"
                    },
                    "rotation": {
                        "type": "integer",
                        "enum": [
                            0,
                            90,
                            180,
                            270
                        ],
                        "description": "Rotation in degrees"
                    },
                    "name": {
                        "type": "string",
                        "description": "Display name for NPC tokens"
                    }
                }
            },
            "description": "Array of placed map tokens"
        },
        "players": {
            "type": "array",
            "items": {
                "type": "object",
                "required": [
                    "id",
                    "name",
                    "gridX",
                    "gridY"
                ],
                "properties": {
                    "id": {
                        "type": "string",
                        "description": "Unique identifier for the player"
                    },
                    "name": {
                        "type": "string",
                        "description": "Player name"
                    },
                    "gridX": {
                        "type": "integer",
                        "description": "Grid column position"
                    },
                    "gridY": {
                        "type": "integer",
                        "description": "Grid row position"
                    }
                }
            },
            "description": "Array of player tokens"
        },
        "zoom": {
            "type": "number",
            "description": "Zoom level"
        },
        "panX": {
            "type": "number",
            "description": "Horizontal pan offset"
        },
        "panY": {
            "type": "number",
            "description": "Vertical pan offset"
        },
        "fog": {
            "type": "array",
            "items": {
                "type": "string",
                "pattern": "^\\d+,\\d+$"
            },
            "description": "Array of 'x,y' strings for fog-of-war cells"
        }
    }
}