{
  "name": "Wizard's Study",
  "gridSize": 30,
  "walls": [
    "12,12",
    "13,12",
    "14,12",
    "15,12",
    "16,12",
    "17,12",
    "18,12",
    "18,13",
    "18,14",
    "18,15",
    "18,16",
    "18,17",
    "18,18",
    "17,18",
    "16,18",
    "14,18",
    "13,18",
    "12,18",
    "12,17",
    "12,16",
    "12,15",
    "12,14",
    "12,13",
    "10,13",
    "11,12",
    "11,14",
    "20,13",
    "19,12",
    "19,14",
    "10,15",
    "11,16",
    "20,15",
    "19,16",
    "15,9",
    "14,10",
    "16,10",
    "14,19",
    "14,20",
    "14,21",
    "14,22",
    "14,23",
    "14,24",
    "14,25",
    "14,26",
    "14,27",
    "16,19",
    "16,20",
    "16,21",
    "16,22",
    "16,23",
    "16,24",
    "16,25",
    "16,26",
    "16,27",
    "12,28",
    "13,28",
    "14,28",
    "16,28",
    "17,28",
    "18,28"
  ],
  "placedItems": [
    {
      "id": "door-1",
      "gridX": 15,
      "gridY": 28,
      "type": "door",
      "visible": true,
      "rotation": 0
    },
    {
      "id": "door-2",
      "gridX": 15,
      "gridY": 11,
      "type": "door",
      "visible": true,
      "rotation": 0
    },
    {
      "id": "shelf-1",
      "gridX": 13,
      "gridY": 14,
      "type": "bookshelf",
      "visible": true,
      "rotation": 0
    },
    {
      "id": "shelf-2",
      "gridX": 17,
      "gridY": 14,
      "type": "bookshelf",
      "visible": true,
      "rotation": 90
    },
    {
      "id": "shelf-3",
      "gridX": 15,
      "gridY": 10,
      "type": "bookshelf",
      "visible": true,
      "rotation": 0
    },
    {
      "id": "shelf-4",
      "gridX": 15,
      "gridY": 24,
      "type": "bookshelf",
      "visible": true,
      "rotation": 0
    },
    {
      "id": "table-1",
      "gridX": 15,
      "gridY": 15,
      "type": "table",
      "visible": true,
      "rotation": 0
    },
    {
      "id": "chair-1",
      "gridX": 15,
      "gridY": 16,
      "type": "chair",
      "visible": true,
      "rotation": 0
    },
    {
      "id": "torch-1",
      "gridX": 14,
      "gridY": 11,
      "type": "torch",
      "visible": true,
      "rotation": 0
    },
    {
      "id": "torch-2",
      "gridX": 16,
      "gridY": 11,
      "type": "torch",
      "visible": true,
      "rotation": 0
    },
    {
      "id": "torch-3",
      "gridX": 15,
      "gridY": 27,
      "type": "torch",
      "visible": true,
      "rotation": 0
    },
    {
      "id": "chest-1",
      "gridX": 15,
      "gridY": 22,
      "type": "chest",
      "visible": true,
      "rotation": 0
    },
    {
      "id": "altar-1",
      "gridX": 5,
      "gridY": 5,
      "type": "altar",
      "visible": true,
      "rotation": 0
    }
  ],
  "players": [
    {
      "id": "p1",
      "name": "Adventurer",
      "gridX": 15,
      "gridY": 28
    }
  ],
  "zoom": 1,
  "panX": 0,
  "panY": 0,
  "fog": [
    "0,0",
    "1,0",
    "2,0",
    "0,1",
    "1,1",
    "2,1",
    "0,2",
    "1,2",
    "2,2",
    "29,0",
    "28,0",
    "27,0",
    "29,1",
    "28,1",
    "27,1",
    "29,2",
    "28,2",
    "27,2",
    "0,29",
    "1,29",
    "2,29",
    "29,29",
    "28,29",
    "27,29",
    "0,28",
    "1,28",
    "2,28",
    "29,28",
    "28,28",
    "27,28",
    "29,27",
    "28,27",
    "27,27",
    "0,15",
    "1,15",
    "2,15",
    "28,15",
    "29,15",
    "4,4",
    "4,5",
    "4,6",
    "5,4",
    "5,5",
    "5,6",
    "6,4",
    "6,5",
    "6,6"
  ]
}